{
  "type": "deployment_bound",
  "alg": "Ed25519",
  "key_id": "atm-key-2026-q2",
  "issued_at": "2026-04-19T18:00:00Z",
  "expires_at": "2026-05-19T18:00:00Z",
  "signature": "BASE64_SIGNATURE_PLACEHOLDER",
  "deployment_binding": {
    "build_sha": "abc123def456",
    "policy_bundle_sha": "789ghi012jkl",
    "runtime_profile": "production-us-west",
    "container_image_digest": "sha256:0123456789abcdef"
  }
}
